{
  "$schema": "https://tau.new/schemas/tau-v1.json",
  "name": "TF-2000 Turbofan Assembly",
  "description": "Cutaway two-spool turbofan concept with 2,173 individually named parts, NACA airfoils and animated rotors.",
  "tags": ["turbofan", "mechanism", "picogk"],
  "assets": {
    "main": { "entryPath": "main.cs", "thumbnail": "thumbnail.webp" }
  }
}
