{
  "$schema": "https://tau.new/schemas/tau-v1.json",
  "name": "Enclosure lid",
  "description": "Uniform-wall open electronics enclosure lid; external dimensions and wall are editable.",
  "tags": [
    "Enclosures",
    "parametric",
    "replicad",
    "warehouse"
  ],
  "assets": {
    "main": {
      "entryPath": "main.ts",
      "thumbnail": "thumbnail.webp"
    }
  }
}
