{
  "$schema": "https://tau.new/schemas/tau-v1.json",
  "name": "U mounting bracket",
  "description": "Parametric mounting geometry with real fastening openings and rounded section corners. Dimensions and patterns are generic, fully editable design inputs.",
  "tags": [
    "Brackets and plates",
    "parametric",
    "replicad",
    "warehouse"
  ],
  "assets": {
    "main": {
      "entryPath": "main.ts",
      "thumbnail": "thumbnail.webp"
    }
  }
}
