{
  "$schema": "https://tau.new/schemas/tau-v1.json",
  "name": "Concentric reducer",
  "description": "Generic fitting with a deliberately modeled flow passage, wall and end interfaces; plugs and blind flanges intentionally close the passage.",
  "tags": [
    "Fluid fittings",
    "parametric",
    "replicad",
    "warehouse"
  ],
  "assets": {
    "main": {
      "entryPath": "main.ts",
      "thumbnail": "thumbnail.webp"
    }
  }
}
