{
  "$schema": "https://tau.new/schemas/tau-v1.json",
  "name": "PicoVoxel Lattice Manifold",
  "description": "PicoVoxel Lattice Manifold community example, adapted to Tau's injected-session runtime.",
  "tags": ["picovoxel", "typescript", "community-example"],
  "assets": {
    "main": {
      "entryPath": "main.ts",
      "thumbnail": "thumbnail.webp"
    }
  }
}
