{
  "$schema": "https://tau.new/schemas/tau-v1.json",
  "name": "V-groove pulley",
  "description": "Turned sheave with sloping groove flanks and a central shaft bore.",
  "tags": [
    "Shafts and bushings",
    "parametric",
    "replicad",
    "warehouse"
  ],
  "assets": {
    "main": {
      "entryPath": "main.ts",
      "thumbnail": "thumbnail.webp"
    }
  }
}
