{
  "$schema": "https://tau.new/schemas/tau-v1.json",
  "name": "Cable clip",
  "description": "Open cable-retention clip with a flat mounting foot.",
  "tags": [
    "Cable hardware",
    "parametric",
    "replicad",
    "warehouse"
  ],
  "assets": {
    "main": {
      "entryPath": "main.ts",
      "thumbnail": "thumbnail.webp"
    }
  }
}
