{
  "$schema": "https://tau.new/schemas/tau-v1.json",
  "name": "Heat-set insert",
  "description": "Heat-set insert with editable millimetre dimensions and a deliberately symbolic thread.",
  "tags": [
    "Fasteners",
    "parametric",
    "replicad",
    "warehouse"
  ],
  "assets": {
    "main": {
      "entryPath": "main.ts",
      "thumbnail": "thumbnail.webp"
    }
  }
}
